Stage,Lead Name,Contact Info,Offer Tier,Quoted Price,Lead Source,Next Step,Owner,Last Updated,Notes
Lead,Alex Rivera,alex@example.com,$130 Base,$130,Friends/Family,Send discovery DM,Maria,2026-02-23,"Wants to offload old phone, confirm model"
Qualified,Bri Chen,@bri-chen (IG),$180 Concierge,$180,Local Groups,Sending payment links,Dre,2026-02-23,"Needs fast turnaround for trip Friday"
Paid,Chris Patel,chrisp@gmail.com,$180 Concierge,$180,Online Communities,Schedule prep slot,Nina,2026-02-23,"Paid via Cash App, prefers delivery"
Prep,Devon Lane,555-0123,$130 Base,$160 (incl. restock),Referral,Complete 2-hr prep checklist,Asha,2026-02-23,"Restock fee added for special color"
Shipped,Eli Torres,eli.torres@example.com,$130 Base,$130,Friends/Family,Send tracking + confirmation,Maria,2026-02-22,"UPS 1Z45..."
Follow-up,Farah Ali,farahali@example.com,$180 Concierge,$180,Online Communities,Request testimonial in 3 days,Dre,2026-02-21,"Loves concierge setup, ask for referrals"
